index,text,category
1,Health care advances improve life expectancy,Health
2,New smartphone model released with advanced features,Technology
3,Stock market hits record high amid economic optimism,Finance
4,Spring fashion trends include bright colors and bold patterns,Fashion
5,Political leaders debate new climate change policies,Politics
6,Breakthrough in cancer treatment shows promising results,Health
7,Tech startup launches innovative AI software,Technology
8,Banking sector sees significant growth in digital transactions,Finance
9,Fashion industry embraces sustainable materials,Fashion
10,Government passes new healthcare reform bill,Politics
11,Researchers develop new wearable health monitoring device,Health
12,Cybersecurity threats increase with rise in remote work,Technology
13,Investors flock to renewable energy stocks,Finance
14,Luxury brands experiment with virtual fashion shows,Fashion
15,Elections highlight the importance of social media campaigns,Politics
